### ISSUE TITLE
🐛 BUG: When uses a domain name on static_host_map, the IPv4 DNS result is treated as an IPv6 address when connecting

### ISSUE THREAD

**Issue by SwimmingTiger** [slackhq/nebula#875]
### What version of `nebula` are you using?

1.7.0

### What operating system are you using?

Linux

### Describe the Bug

My kernel:

```
# uname -a
Linux XiaoQiang 4.4.60 #0 SMP PREEMPT Tue Feb 7 11:09:02 2023 armv7l GNU/Linux
```

I downloaded this: https://github.com/slackhq/nebula/releases/download/v1.7.0/nebula-linux-arm-7.tar.gz

I have dual stack environment at home, IPv4 only on the lighthouse node.

`nebula.yaml` at home (part):

```
static_host_map:
  "10.98.76.1": ["ipv4.test-ipv6.com:4242"] # The domain name is fake for testing only
lighthouse:
  am_lighthouse: false
  interval: 60
  hosts:
    - "10.98.76.1"
```

Then I cannot connect to the lighthouse.

The log is normal:

```
# ./nebula -config ./miwifi.yaml
INFO[2023-05-18 02:49:45] Firewall rule added                           firewallRule="map[caName: caSha: direction:outgoing endPort:0 groups:[] host:any ip: localIp: proto:0 startPort:0]"
INFO[2023-05-18 02:49:45] Firewall rule added                           firewallRule="map[caName: caSha: direction:incoming endPort:0 groups:[] host:any ip: localIp: proto:0 startPort:0]"
INFO[2023-05-18 02:49:45] Firewall started                              firewallHash=498215dec4e5687a2353f51c10838c113bd1af35ef72b8e8c9f536986ada5417
INFO[2023-05-18 02:49:45] Main HostMap created                          network=10.98.76.2/24 preferredRanges="[]"
INFO[2023-05-18 02:49:45] punchy enabled                               
INFO[2023-05-18 02:49:45] Loaded send_recv_error config                 sendRecvError=always
INFO[2023-05-18 02:49:45] Nebula interface is active                    boringcrypto=false build=1.7.0 interface=nebula network=10.98.76.2/24 udpAddr="[::]:4242"                                                                                                                           
INFO[2023-05-18 02:49:45] DNS results changed for host list             newSet="map[139.162.111.58:4242:{}]" origSet="&map[]"
INFO[2023-05-18 02:49:45] Handshake message sent                        handshake="map[stage:1 style:ix_psk0]" initiatorIndex=817550407 localIndex=817550407 remoteIndex=0 udpAddrs="[139.162.111.58:4242]" vpnIp=10.98.76.1   
```

But the tcpdump:

```
# tcpdump -i pppoe-wan -l udp port 4242
tcpdump: verbose output suppressed, use -v or -vv for full protocol decode
listening on pppoe-wan, link-type LINUX_SLL (Linux cooked), capture size 262144 bytes
10:40:23.758155 IP6 2408:8206:xxxx:xxxx:xxxx:xxxx:20e1:a611.4242 > 7a09:9360::.4242: UDP, length 247
10:40:24.016567 IP6 2408:8206:xxxx:xxxx:xxxx:xxxx:20e1:a611.4242 > 7a09:9360::.4242: UDP, length 247
……
```

So it is using an IPv4 address as an IPv6 address for network connections, and the IPv4 value is placed at the beginning of the IPv6 address. This is obviously incompatible. In order to use an IPv4 address in a IPv6 socket, `::ffff:2408:8206` should be used.

-----------

If I instead use a IP address in the static_host_map everything works fine:

```
static_host_map:
  "10.98.76.1": ["139.162.111.58:4242"] # The address is fake for testing only
```

```
# tcpdump -i pppoe-wan -l udp port 4242
tcpdump: verbose output suppressed, use -v or -vv for full protocol decode
listening on pppoe-wan, link-type LINUX_SLL (Linux cooked), capture size 262144 bytes
10:52:03.029124 IP 10.70.28.134.4242 > 139-162-111-58.ip.linodeusercontent.com.4242: UDP, length 247
10:52:03.398420 IP 10.70.28.134.4242 > 139-162-111-58.ip.linodeusercontent.com.4242: UDP, length 247
```
