### ISSUE TITLE
tcpdump shows packets being sent to external servers when running nebula along with Zerotier.

### ISSUE THREAD

**Issue by ahkhan03** [slackhq/nebula#706]
I am testing Nebula and Zerotier to create an overlay network over a few of my servers. I noticed that when nebula and Zerotier are running simultaneously, few packets are being sent to some Zerotier servers (according to reverse DNS lookup) with a regular interval of 5 seconds. tcpdump using `sudo tcpdump -i nebula1` shows the following when Zerotier is also running

```
tcpdump: verbose output suppressed, use -v[v]... for full protocol decode
listening on nebula1, link-type RAW (Raw IP), snapshot length 262144 bytes
11:43:35.342251 IP [MyHostname].9993 > root-mia-01.zerotier.com.9993: UDP, length 137
11:43:35.342539 IP [MyHostname].58267 > root-mia-01.zerotier.com.9993: UDP, length 137
11:43:35.342713 IP [MyHostname].27622 > root-mia-01.zerotier.com.9993: UDP, length 137
11:43:35.343041 IP [MyHostname].9993 > root-zrh-01.zerotier.com.9993: UDP, length 137
11:43:35.343229 IP [MyHostname].58267 > root-zrh-01.zerotier.com.9993: UDP, length 137
11:43:35.343407 IP [MyHostname].27622 > root-zrh-01.zerotier.com.9993: UDP, length 137
11:43:35.343721 IP [MyHostname].9993 > root-sgp-01.zerotier.com.9993: UDP, length 137
11:43:35.343901 IP [MyHostname].58267 > root-sgp-01.zerotier.com.9993: UDP, length 137
11:43:35.344067 IP [MyHostname].27622 > root-sgp-01.zerotier.com.9993: UDP, length 137
11:43:35.344388 IP [MyHostname].9993 > 104.194.8.134.9993: UDP, length 137
11:43:35.344590 IP [MyHostname].58267 > 104.194.8.134.9993: UDP, length 137
11:43:35.344770 IP [MyHostname].27622 > 104.194.8.134.9993: UDP, length 137
11:43:40.340318 IP [MyHostname].9993 > root-zrh-01.zerotier.com.9993: UDP, length 137
11:43:40.340502 IP [MyHostname].58267 > root-zrh-01.zerotier.com.9993: UDP, length 137
11:43:40.340681 IP [MyHostname].27622 > root-zrh-01.zerotier.com.9993: UDP, length 137
11:43:40.427199 IP [MyHostname].9993 > 222.49.209.35.bc.googleusercontent.com.39765: UDP, length 137
11:43:40.427535 IP [MyHostname].58267 > 222.49.209.35.bc.googleusercontent.com.39765: UDP, length 137
11:43:40.427827 IP [MyHostname].27622 > 222.49.209.35.bc.googleusercontent.com.39765: UDP, length 137
11:43:40.944464 IP [MyHostname].9993 > 158.132.186.130.1102: UDP, length 137
11:43:40.944833 IP [MyHostname].58267 > 158.132.186.130.1102: UDP, length 137
11:43:40.945170 IP [MyHostname].27622 > 158.132.186.130.1102: UDP, length 137
11:43:40.988911 IP [MyHostname].9993 > 158.132.186.130.59390: UDP, length 137
11:43:40.989320 IP [MyHostname].58267 > 158.132.186.130.59390: UDP, length 137
11:43:40.989703 IP [MyHostname].27622 > 158.132.186.130.59390: UDP, length 137
11:43:40.991000 IP [MyHostname].9993 > 192.168.0.242.9993: UDP, length 137
11:43:40.991359 IP [MyHostname].58267 > 192.168.0.242.9993: UDP, length 137
11:43:40.991678 IP [MyHostname].27622 > 192.168.0.242.9993: UDP, length 137
11:43:40.992829 IP [MyHostname].9993 > 192.168.0.242.61391: UDP, length 137
11:43:40.993167 IP [MyHostname].58267 > 192.168.0.242.61391: UDP, length 137
11:43:40.993485 IP [MyHostname].27622 > 192.168.0.242.61391: UDP, length 137
11:43:40.994600 IP [MyHostname].9993 > 192.168.0.242.59390: UDP, length 137
11:43:40.994935 IP [MyHostname].58267 > 192.168.0.242.59390: UDP, length 137
11:43:40.995243 IP [MyHostname].27622 > 192.168.0.242.59390: UDP, length 137
```

A longer dump can be found here: https://pastebin.com/ihd7BSzC. 

All of this stop as soon as I stop Zerotier. I only noticed this on Linux hosts (Ubuntu 22.04 and Raspbian). This doesn't happen on macOS. I am not too well-versed in networking stack to further track down the cause. Is there a reason why this could be happening? Are Nebula and Zerotier somehow interfering with each other? How can I see what type of data is being sent to these Zerotier servers?

**Comment by caguiclajmg** [comment]
I'm not currently running Nebula but am seeing the same activity from my machines running ZeroTier.

The traffic you're seeing are local network discovery packets. These are essentially "pings" used to figure out if two machines are connected together through some other (preferably faster) network (e.g. two nodes residing on the same LAN).

I believe nebula's `preferred_ranges` is a similar concept.

**Comment by ahkhan03** [comment]
This seems correct. I just checked. It isn't specific to the nebula interface; packets are being sent through all network interfaces. It is probably how the Zerotier works.
