### ISSUE TITLE
🐛 BUG: Handshake Timeout Between Node and Lighthouse

### ISSUE THREAD

**Issue by gamegoofs2** [slackhq/nebula#1545]
### What version of `nebula` are you using? (`nebula -version`)

1.9.7

### What operating system are you using?

Linux

### Describe the Bug

I have nebula set up as a lighthouse on a cloud VM and on a Ubuntu VM node in my network. The port for the lighthouse (4242) is open to the VM. I confirmed traffic is making it to the lighthouse (cloud VM) with `tcpdump 'dst port 4242'` I have confirm ufw is inactive on the node.

The lighthouse doesn't seem to see the incoming handshake request from the node. The node just "Handshake message sent" and about 5 seconds later it says "Handshake timed out".

### Logs from affected hosts

Node `journalctl --unit=nebula -f`
```
Dec 03 17:08:34 ansible nebula[1790675]: time="2025-12-03T17:08:34Z" level=info msg="Firewall rule added" firewallRule="map[caName: caSha: direction:outgoing endPort:0 groups:[] host:any ip: localIp: proto:0 startPort:0]"
Dec 03 17:08:34 ansible nebula[1790675]: time="2025-12-03T17:08:34Z" level=info msg="Firewall rule added" firewallRule="map[caName: caSha: direction:incoming endPort:0 groups:[] host:any ip: localIp: proto:1 startPort:0]"
Dec 03 17:08:34 ansible nebula[1790675]: time="2025-12-03T17:08:34Z" level=info msg="Firewall started" firewallHashes="SHA:807243764ac783d089ea5ae93e0ed7fc0a1da4756ca7cb7ae553e128a2b3eb65,FNV:789024431"
Dec 03 17:08:34 ansible nebula[1790675]: time="2025-12-03T17:08:34Z" level=info msg="listening on [::]:0"
Dec 03 17:08:34 ansible nebula[1790675]: time="2025-12-03T17:08:34Z" level=info msg="Main HostMap created" network=192.168.100.27/24 preferredRanges="[]"
Dec 03 17:08:34 ansible nebula[1790675]: time="2025-12-03T17:08:34Z" level=info msg="punchy disabled"
Dec 03 17:08:34 ansible nebula[1790675]: time="2025-12-03T17:08:34Z" level=info msg="Loaded send_recv_error config" sendRecvError=always
Dec 03 17:08:34 ansible nebula[1790675]: time="2025-12-03T17:08:34Z" level=info msg="Nebula interface is active" boringcrypto=false build=1.9.7 interface=tun0 network=192.168.100.27/24 udpAddr="[::]:40590"
Dec 03 17:08:34 ansible nebula[1790675]: time="2025-12-03T17:08:34Z" level=info msg="DNS results changed for host list" newSet="map[*.*.*.*:4242:{}]" origSet="&map[]"
Dec 03 17:08:34 ansible nebula[1790675]: time="2025-12-03T17:08:34Z" level=info msg="Handshake message sent" handshake="map[stage:1 style:ix_psk0]" initiatorIndex=914752756 localIndex=914752756 remoteIndex=0 udpAddrs="[*.*.*.*:4242]" vpnIp=192.168.100.1
Dec 03 17:08:41 ansible nebula[1790675]: time="2025-12-03T17:08:41Z" level=info msg="Handshake timed out" durationNs=7099362613 handshake="map[stage:1 style:ix_psk0]" initiatorIndex=914752756 localIndex=914752756 remoteIndex=0 udpAddrs="[*.*.*.*:4242]" vpnIp=192.168.100.1
```
Node `systemctl status nebula`
```
● nebula.service - Nebula overlay networking tool
     Loaded: loaded (/etc/systemd/system/nebula.service; enabled; preset: enabled)
     Active: active (running) since Wed 2025-12-03 17:08:34 UTC; 49min ago
   Main PID: 1790675 (nebula)
      Tasks: 11 (limit: 4602)
     Memory: 5.4M (peak: 6.4M)
        CPU: 9.124s
     CGroup: /system.slice/nebula.service
             └─1790675 /usr/local/bin/nebula -config /etc/nebula/config/config.yaml

```

Lighthouse `journalctl --unit=nebula -f`
```
Dec 03 15:31:14 spark nebula[293976]: time="2025-12-03T15:31:14Z" level=info msg="Firewall rule added" firewallRule="map[caName: caSha: direction:outgoing endPort:0 groups:[] host:any ip: localIp: proto:0 startPort:0]"
Dec 03 15:31:14 spark nebula[293976]: time="2025-12-03T15:31:14Z" level=info msg="Firewall rule added" firewallRule="map[caName: caSha: direction:incoming endPort:0 groups:[] host:any ip: localIp: proto:1 startPort:0]"
Dec 03 15:31:14 spark nebula[293976]: time="2025-12-03T15:31:14Z" level=info msg="Firewall rule added" firewallRule="map[caName: caSha: direction:incoming endPort:53 groups:[any] host: ip: localIp: proto:17 startPort:53]"
Dec 03 15:31:14 spark nebula[293976]: time="2025-12-03T15:31:14Z" level=info msg="Firewall started" firewallHashes="SHA:6d0edc6ce610325a21907ee4551524c9ba552c094619f73dfef274a49f3e8bc5,FNV:2564328740"
Dec 03 15:31:14 spark nebula[293976]: time="2025-12-03T15:31:14Z" level=info msg="listening on [::]:4242"
Dec 03 15:31:14 spark nebula[293976]: time="2025-12-03T15:31:14Z" level=info msg="Main HostMap created" network=192.168.100.1/24 preferredRanges="[]"
Dec 03 15:31:14 spark nebula[293976]: time="2025-12-03T15:31:14Z" level=info msg="punchy disabled"
Dec 03 15:31:14 spark nebula[293976]: time="2025-12-03T15:31:14Z" level=info msg="Loaded send_recv_error config" sendRecvError=always
Dec 03 15:31:14 spark nebula[293976]: time="2025-12-03T15:31:14Z" level=info msg="Nebula interface is active" boringcrypto=false build=1.9.7 interface=tun0 network=192.168.100.1/24 udpAddr="[::]:4242"
Dec 03 15:31:14 spark nebula[293976]: time="2025-12-03T15:31:14Z" level=info msg="Starting DNS responder" dnsListener="[::]:53"

```

Lighthouse `systemctl status nebula`
```

● nebula.service - Nebula overlay networking tool
     Loaded: loaded (/etc/systemd/system/nebula.service; enabled; preset: enabled)
     Active: active (running) since Wed 2025-12-03 17:59:54 UTC; 8s ago
   Main PID: 357946 (nebula)
      Tasks: 8 (limit: 7005)
     Memory: 1.8M (peak: 2.0M)
        CPU: 15ms
     CGroup: /system.slice/nebula.service
             └─357946 /usr/local/bin/nebula -config /etc/nebula/config/config.yaml
```

### Config files from affected hosts

Node
```
# PKI paths
pki:
  ca: /etc/nebula/ca.crt
  cert: /etc/nebula/host.crt
  key: /etc/nebula/host.key

# Need a static host map, using the DNS name of the lighthouse
static_host_map:
  '192.168.100.1': ['lighthouse.example.net:4242']

static_map:
  network: ip4

# Lighthouse config for clients
lighthouse:
  hosts:
    - '192.168.100.1'

#Listen
listen:
  host: '[::]'
  #Port of 0 means randomly choose, usually good for clients
  #Want to set to 4242 for relays and lighthouses
  port: 0

#Firewall settings
firewall:
  outbound:
    # Allow all outbound traffic from this node
    - port: any
      proto: any
      host: any

  inbound:
    # Allow icmp between any nebula hosts
    - port: any
      proto: icmp
      host: any

```

Lighthouse
```
# PKI paths
pki:
  ca: /etc/nebula/ca.crt
  cert: /etc/nebula/host.crt
  key: /etc/nebula/host.key

# Port settings
listen:
  host: '[::]'
  port: 4242

# No static hosts for lighthouses
static_host_map:

#Lighthouse settings
lighthouse:
  am_lighthouse: true
  # Enable serving DNS to anyone (Even our external IP)
  serve_dns: true
  dns:
    host: '[::]'
    port: 53

#Firewall settings
firewall:
  outbound:
    # Allow all outbound traffic from this node
    - port: any
      proto: any
      host: any

  inbound:
    # Allow icmp between any nebula hosts
    - port: any
      proto: icmp
      host: any
    # Allow DNS incoming since we are serving DNS at this lighthouse
    - port: 53
      proto: udp
      group: any

```
Lighthouse `tcpdump 'dst port 4242'`
```
tcpdump: verbose output suppressed, use -v[v]... for full protocol decode
listening on enp0s6, link-type EN10MB (Ethernet), snapshot length 262144 bytes
18:02:54.886586 IP *.*.*.*.23140 > spark.default.example.example.com.4242: UDP, length 270
18:02:55.080717 IP *.*.*.*.23140 > spark.default.example.example.com.4242: UDP, length 270
18:02:55.482698 IP *.*.*.*.23140 > spark.default.example.example.com.4242: UDP, length 270
18:02:55.980579 IP *.*.*.*.23140 > spark.default.example.example.com.4242: UDP, length 270
18:02:56.479567 IP *.*.*.*.23140 > spark.default.example.example.com.4242: UDP, length 270

```

**Comment by nbrownus** [comment]
If the lighthouse isn't seeing the handshakes then either the host sending the handshakes is blocked or the lighthouse isn't actually accessible on it's listening port (NAT or firewall)

**Comment by gamegoofs2** [comment]
@nbrownus I thought the same thing initially, but the tcpdump shows traffic to UDP port 4242 coming from my network when I run the node. It's like the lighthouse isn't processing the incoming handshake.

**Comment by nbrownus** [comment]
> The port for the lighthouse (4242) is open to the VM

Can you describe the lighthouse situation a bit more?

Enabling debug logging might shed some light but I suspect there is something after the `tcpdump` that's getting in the way. 

Is the `tcpdump` being run in the same context as the `nebula` process in this environment? Any other containers or virtualization or network namespacing?

Do you have something like SELinux running that might be blocking packet flow?

**Comment by gamegoofs2** [comment]
Thanks @nbrownus, I did have docker containers running, but they weren't the problem. This led me down another path to discover that iptables were blocking the port. After allowing udp 4242 with iptables, the handshake was able to complete.

TIL, tcpdump is before iptables. Always learning something new with Linux.
