### ISSUE TITLE
Packets To Service on Lighthouse Being Dropped

### ISSUE THREAD

**Issue by AndrewPaglusch** [slackhq/nebula#229]
I have about 20 servers connected to Nebula in the 192.168.77.0/24 network. I have no groups defined. My lighthouse is at 192.168.77.1. I am trying to expose ports 4505 and 4506 (TCP) on my lighthouse server to all clients.

Some of my clients are able to reach the service listening on 4505 on the lighthouse, but most are not. All of my clients are able to ping the lighthouse (and vice versa). All clients have identical Nebula config. selinux is disabled on all clients. A tcpdump on the lighthouse shows absolutely no traffic coming in on `neb0`, so the connections are being dropped client-side (you can see that in the Nebual logs).

Below is some debug info I took from one of the clients while I ran `telnet 192.168.77.1 4505`.

**Nebula version**
```
[root@node02 ~]# /opt/nebula/nebula --version
Version: 1.2.0
```

**tcpdump output**
```
[root@node02 ~]# tcpdump -lnni neb0
tcpdump: verbose output suppressed, use -v or -vv for full protocol decode
listening on neb0, link-type RAW (Raw IP), capture size 262144 bytes
14:21:35.859843 IP 192.168.77.4.34070 > 192.168.77.1.4505: Flags [S], seq 3845955271, win 25200, options [mss 1260,sackOK,TS val 758870704 ecr 0,nop,wscale 7], length 0
14:21:37.863836 IP 192.168.77.4.34070 > 192.168.77.1.4505: Flags [S], seq 3845955271, win 25200, options [mss 1260,sackOK,TS val 758872708 ecr 0,nop,wscale 7], length 0
14:21:41.875840 IP 192.168.77.4.34070 > 192.168.77.1.4505: Flags [S], seq 3845955271, win 25200, options [mss 1260,sackOK,TS val 758876720 ecr 0,nop,wscale 7], length 0
```

**Nebula debug output**
```
May 08 14:25:22 node02 nebula[25520]: time="2020-05-08T14:25:22Z" level=debug msg="dropping outbound packet" certName=lighthouse fwPacket="&{3232255236 3232255233 34104 4505 6 false}" vpnIp=192.168.77.1
May 08 14:25:22 node02 nebula[25520]: time="2020-05-08T14:25:22Z" level=debug msg="dropping outbound packet" certName=lighthouse fwPacket="&{3232255236 3232255233 36136 4506 6 false}" vpnIp=192.168.77.1
May 08 14:25:23 node02 nebula[25520]: time="2020-05-08T14:25:23Z" level=debug msg="dropping outbound packet" certName=lighthouse fwPacket="&{3232255236 3232255233 34104 4505 6 false}" vpnIp=192.168.77.1
```

**IPTables rules**
```
[root@node02 ~]# iptables -L -v -n
Chain INPUT (policy ACCEPT 2852K packets, 1257M bytes)
 pkts bytes target     prot opt in     out     source               destination

Chain FORWARD (policy ACCEPT 0 packets, 0 bytes)
 pkts bytes target     prot opt in     out     source               destination

Chain OUTPUT (policy ACCEPT 2721K packets, 1674M bytes)
 pkts bytes target     prot opt in     out     source               destination
```

**Nebula config**
```
pki:
  ca: /opt/nebula/ca.crt
  cert: /opt/nebula/node02.crt
  key: /opt/nebula/node02.key

static_host_map:
 "192.168.77.1": ["lighthouse.redacted.com:4242"]

lighthouse:
  interval: 60
  am_lighthouse: false

  hosts:
    - "192.168.77.1"

listen:
  host: 0.0.0.0
  port: 4242

punchy: true
punch_back: true

tun:
  dev: neb0
  drop_local_broadcast: false
  drop_multicast: false
  tx_queue: 500
  mtu: 1300
  routes:

logging:
  level: debug
  format: text

firewall:
  conntrack:
    tcp_timeout: 120h
    udp_timeout: 3m
    default_timeout: 10m
    max_connections: 100000

  outbound:
    - port: 22
      proto: tcp
      host: any
    - port: any
      proto: icmp
      host: any
    - port: 4505
      proto: tcp
      host: 192.168.77.1
    - port: 4506
      proto: tcp
      host: 192.168.77.1

  inbound:
    - port: 22
      proto: tcp
      host: any
    - port: any
      proto: icmp
      host: any
```

**Comment by fm407** [comment]
i am fairly sure this is wrong:

`    - port: 4505
      proto: tcp
      host: 192.168.77.1
    - port: 4506
      proto: tcp
      host: 192.168.77.1`

i dont think host accepts IPs you need to use cidr: instead

```
host: any or a node's name from the nebula-cert tool
group: any or a group name from the nebula-cert tool
groups: a dictionary of viable group names, AND'd together - discussed after
cidr: Some CIDR mask, e.g. 10.0.0.0/8 or 192.0.2.0/24 or 198.51.100.100/32
```

**Comment by AndrewPaglusch** [comment]
That fixed it! Thanks a lot. I wonder why a handful of my other servers didn't run into a problem with the same bad config.
